2022-08-01 14:18:00,2022-08-01 15:24:00,IP Address,67.170.151.29,100,3959,TRUE,2022-08-01 15:24:02,R_yUsvnpMLfUH1IAN,,,,,44.1449,-123.0491,anonymous,EN,,F_2dLK5BLKGT8a0tI,signature.png,7879,image/png,d21_02,23,Male (cisgender or transgender),Male,White,"No, not of Hispanic, Latino/a/x, or Spanish origin",Strongly Agree,Slightly Agree,Strongly Disagree,Strongly Agree,Strongly Agree,Strongly Disagree,Slightly Agree,Slightly Disagree,Slightly Disagree,Slightly Disagree,Strongly Disagree,Slightly Disagree,Slightly Agree,Strongly Agree,Slightly Disagree,Strongly Disagree,Strongly Disagree,Strongly Agree,Neither Agree or Disagree,Strongly Disagree,Slightly Agree,Slightly Agree,Slightly Agree,Slightly Disagree,Slightly Agree,Strongly Agree,Slightly Agree,Slightly Disagree,Strongly Disagree,Strongly Disagree,Slightly Agree,Slightly Disagree,Strongly Agree,Slightly Disagree,Slightly Agree,Slightly Disagree,Strongly Disagree,Slightly Disagree,Neither Agree or Disagree,Neither Agree or Disagree,Slightly Disagree,Slightly Disagree,Neither Agree or Disagree,Strongly Agree,Neither Agree or Disagree,Slightly Agree,Neither Agree or Disagree,Strongly Disagree,Slightly Disagree,Slightly Disagree,Neither Agree or Disagree,Strongly Disagree,Sometimes,Sometimes,Fairly Often,Very Often,Fairly Often,Not very Confident,Once in a great While,Fairly Much,Very Long,Not Very Much,Sometimes,Once in a great While,Slightly,Very Often,Sometimes,Fairly Much,Very Often,Sometimes,Very Often,Fairly Often,Very Often,Practically Never,Very Often,Slightly,Fairly Often,Very Often,Very Often,Practically Never,Very Often,Sometimes,Slightly,Fairly Much,Fairly Much,Once in a great While,Very Much,Not very Rattled,I am very confident,I am quite confident,I am quite confident,I am quite confident,I am very confident,I am quite confident,I am somewhat confident,I am quite confident,I am very confident,Occasionally,Half of the time,Occasionally,Occasionally,Half of the time,Half of the time,Half of the time,Occasionally,Occasionally,Half of the time,Neither agree or disagree,Slightly Disagree,Slightly agree,Neither agree or disagree,Slightly Disagree,Agree,Strongly Disagree,Strongly Agree,Agree,Disagree,Sometimes,Rarely,Never,Often,Sometimes,Rarely,Never,Never,Often,Rarely,Always,Sometimes,Sometimes,Often,Sometimes,Rarely,Sometimes,Often,Sometimes,Never,Never,Sometimes,Sometimes,Sometimes,Sometimes,Sometimes,Sometimes,Rarely,0 years 2 months,ACQUAINTANCE,Not close at all,Not close at all,Slightly Disagree,Strongly Agree,Strongly Disagree,Slightly Agree,Strongly Agree,Slightly Agree,Slightly Disagree,Strongly Disagree,Neither Agree nor Disagree,Neither Agree nor Disagree,Slightly Agree,Neither Agree nor Disagree,Slightly Agree,Slightly Agree,Neither Agree nor Disagree,Strongly Agree,Strongly Disagree,Slightly Agree,Strongly Agree,Strongly Disagree,Strongly Disagree,Slightly Agree,Strongly Agree,Strongly Agree,Strongly Agree,Strongly Disagree,Slightly Agree,Slightly Disagree,Slightly Disagree,Strongly Disagree,Strongly Disagree,Strongly Disagree,Strongly Agree,Agree,Agree,Neither Agree nor Disagree,Agree,Agree,Neither Agree nor Disagree,Strongly Disagree,Agree,Agree,Disagree,Agree,Strongly Disagree,Strongly Disagree,Disagree,Neither Agree nor Disagree,Strongly Agree,Strongly Agree,Strongly Disagree,Strongly Agree,Strongly Disagree,Strongly Agree,Strongly Agree,Strongly Disagree,Strongly Agree,Strongly Agree,Strongly Disagree,Strongly Agree,Agree,Strongly Agree,Agree,Strongly Agree,Disagree,Agree,Strongly Agree,Strongly Disagree,Strongly Agree,Strongly Disagree,Not at all,Not at all,Not at all,Not at all,Not at all,Neutral,Not at all,Neither Agree nor Disagree,Strongly Disagree,Strongly Agree,Disagree,Strongly Disagree,Strongly Disagree,Strongly Disagree,Strongly Disagree,Agree,Strongly Disagree,Strongly Disagree,Strongly Agree,Strongly Disagree,Agree,Agree,Disagree,Disagree,Agree,Agree,Disagree,Neither Agree nor Disagree,Strongly Agree,
2022-08-01 16:26:43,2022-08-01 16:54:40,IP Address,128.223.223.185,100,1676,TRUE,2022-08-01 16:54:41,R_3kumy8IAeCo13QC,,,,,44.0683,-123.0763,anonymous,EN,,F_31FX3UCvtO1fdBH,signature.png,7430,image/png,d22_02,22,Male (cisgender or transgender),Male,Asian,Other,Strongly Agree,Slightly Agree,Neither Agree or Disagree,Slightly Agree,Slightly Agree,Neither Agree or Disagree,Slightly Disagree,Strongly Agree,Slightly Agree,Strongly Disagree,Slightly Disagree,Strongly Agree,Slightly Agree,Slightly Agree,Neither Agree or Disagree,Slightly Disagree,Slightly Disagree,Neither Agree or Disagree,Slightly Agree,Neither Agree or Disagree,Neither Agree or Disagree,Strongly Agree,Strongly Agree,Slightly Agree,Neither Agree or Disagree,Strongly Agree,Strongly Agree,Strongly Agree,Slightly Agree,Neither Agree or Disagree,Slightly Agree,Strongly Agree,Strongly Agree,Strongly Disagree,Slightly Agree,Slightly Agree,Slightly Agree,Slightly Agree,Slightly Agree,Slightly Agree,Strongly Disagree,Neither Agree or Disagree,Neither Agree or Disagree,Slightly Agree,Neither Agree or Disagree,Strongly Agree,Strongly Agree,Neither Agree or Disagree,Slightly Agree,Slightly Agree,Slightly Agree,Neither Agree or Disagree,Sometimes,Fairly Often,Once in a great While,Sometimes,Very Often,Not at All,Once in a great While,Not at All,Very Long,Fairly Much,Once in a great While,Sometimes,Not very Confident,Fairly Often,Fairly Often,Very Much,Once in a great While,Very Often,Sometimes,Practically Never,Very Often,Once in a great While,Fairly Often,Fairly Much,Once in a great While,Sometimes,Practically Never,Once in a great While,Very Often,Very Often,Not very Confident,Very Much,Not at All,Sometimes,Fairly Much,Not at All Rattled,I am somewhat confident,I am quite confident,I am somewhat confident,I am somewhat confident,I am a little confident,I am somewhat confident,I am a little confident,I am somewhat confident,I am a little confident,Never,Never,Never,Never,Never,All of the time,All of the time,Never,Occasionally,Never,Neither agree or disagree,Slightly agree,Slightly Disagree,Disagree,Slightly agree,Neither agree nor disagree,Neither agree nor disagree,Strongly Agree,Neither agree nor disagree,Neither agree nor disagree,Never,Rarely,Never,Always,Sometimes,Rarely,Rarely,Rarely,Often,Sometimes,Often,Rarely,Rarely,Never,Rarely,Never,Rarely,Sometimes,Rarely,Never,Never,Never,Rarely,Always,Rarely,Often,Never,Rarely,2 weeks,ACQUAINTANCE,Not close at all,Not close at all,Slightly Agree,Neither Agree nor Disagree,Slightly Disagree,Neither Agree nor Disagree,Slightly Agree,Neither Agree nor Disagree,Slightly Disagree,Neither Agree nor Disagree,Neither Agree nor Disagree,Neither Agree nor Disagree,Slightly Agree,Neither Agree nor Disagree,Neither Agree nor Disagree,Slightly Agree,Neither Agree nor Disagree,Slightly Agree,Slightly Disagree,Slightly Agree,Neither Agree nor Disagree,Neither Agree nor Disagree,Neither Agree nor Disagree,Slightly Agree,Slightly Agree,Slightly Agree,Neither Agree nor Disagree,Neither Agree nor Disagree,Neither Agree nor Disagree,Neither Agree nor Disagree,Neither Agree nor Disagree,Neither Agree nor Disagree,Strongly Disagree,Strongly Disagree,Strongly Disagree,Strongly Disagree,Strongly Disagree,Strongly Disagree,Disagree,Strongly Disagree,Neither Agree nor Disagree,Disagree,Strongly Disagree,Agree,Neither Agree nor Disagree,Neither Agree nor Disagree,Strongly Disagree,Strongly Disagree,Strongly Disagree,Strongly Disagree,Agree,Agree,Strongly Disagree,Agree,Disagree,Agree,Agree,Disagree,Agree,Agree,Disagree,Agree,Disagree,Agree,Disagree,Agree,Disagree,Disagree,Agree,Disagree,Agree,Strongly Disagree,Not at all,Not at all,Not at all,Not at all,Not at all,Not at all,Not at all,Neither Agree nor Disagree,Strongly Disagree,Strongly Disagree,Strongly Disagree,Strongly Disagree,Strongly Disagree,Strongly Disagree,Strongly Disagree,Strongly Disagree,Strongly Disagree,Strongly Disagree,Neither Agree nor Disagree,Strongly Disagree,Neither Agree nor Disagree,Neither Agree nor Disagree,Neither Agree nor Disagree,Neither Agree nor Disagree,Neither Agree nor Disagree,Neither Agree nor Disagree,Neither Agree nor Disagree,Neither Agree nor Disagree,Neither Agree nor Disagree,
2022-08-01 16:20:24,2022-08-01 17:00:49,IP Address,128.223.223.104,100,2424,TRUE,2022-08-01 17:00:50,R_3O2hujRfsQnlXHK,,,,,44.0683,-123.0763,anonymous,EN,,F_2fx2tXcAVuHmdE1,signature.png,10608,image/png,d22_01,21,Male (cisgender or transgender),Male,Asian,"No, not of Hispanic, Latino/a/x, or Spanish origin",Neither Agree or Disagree,Slightly Agree,Neither Agree or Disagree,Neither Agree or Disagree,Slightly Agree,Slightly Agree,Slightly Disagree,Neither Agree or Disagree,Neither Agree or Disagree,Slightly Disagree,Slightly Agree,Slightly Agree,Slightly Agree,Neither Agree or Disagree,Slightly Agree,Neither Agree or Disagree,Slightly Disagree,Strongly Agree,Slightly Agree,Slightly Disagree,Slightly Disagree,Slightly Agree,Slightly Agree,Slightly Agree,Slightly Agree,Slightly Disagree,Slightly Disagree,Neither Agree or Disagree,Slightly Agree,Slightly Disagree,Slightly Agree,Slightly Agree,Neither Agree or Disagree,Slightly Disagree,Neither Agree or Disagree,Neither Agree or Disagree,Neither Agree or Disagree,Slightly Agree,Slightly Agree,Slightly Agree,Neither Agree or Disagree,Neither Agree or Disagree,Neither Agree or Disagree,Neither Agree or Disagree,Slightly Agree,Slightly Agree,Neither Agree or Disagree,Slightly Agree,Neither Agree or Disagree,Neither Agree or Disagree,Neither Agree or Disagree,Neither Agree or Disagree,Sometimes,Sometimes,Sometimes,Sometimes,Sometimes,Fairly Confident,Once in a great While,Not Very Much,Not Very Long,Not Very Much,Once in a great While,Once in a great While,Fairly Confident,Once in a great While,Sometimes,Not at All,Once in a great While,Sometimes,Once in a great While,Once in a great While,Once in a great While,Once in a great While,Practically Never,Not Very Much,Sometimes,Fairly Often,Sometimes,Sometimes,Sometimes,Sometimes,Slightly,Not Very Much,Slightly,Once in a great While,Slightly,Not very Rattled,I am quite confident,I am somewhat confident,I am somewhat confident,I am somewhat confident,I am somewhat confident,I am somewhat confident,I am somewhat confident,I am somewhat confident,I am somewhat confident,Half of the time,Half of the time,Half of the time,Half of the time,Half of the time,Half of the time,Half of the time,Half of the time,Half of the time,Half of the time,Neither agree or disagree,Neither agree or disagree,Neither agree or disagree,Neither agree or disagree,Neither agree or disagree,Neither agree nor disagree,Neither agree nor disagree,Neither agree nor disagree,Neither agree nor disagree,Neither agree nor disagree,Sometimes,Sometimes,Sometimes,Sometimes,Rarely,Sometimes,Sometimes,Rarely,Rarely,Rarely,Rarely,Sometimes,Sometimes,Sometimes,Often,Sometimes,Sometimes,Sometimes,Sometimes,Sometimes,Sometimes,Sometimes,Sometimes,Sometimes,Sometimes,Sometimes,Sometimes,Sometimes,2 weeks,ACQUAINTANCE,Not close at all,Not close at all,Slightly Agree,Neither Agree nor Disagree,Neither Agree nor Disagree,Neither Agree nor Disagree,Neither Agree nor Disagree,Neither Agree nor Disagree,Neither Agree nor Disagree,Neither Agree nor Disagree,Neither Agree nor Disagree,Neither Agree nor Disagree,Neither Agree nor Disagree,Neither Agree nor Disagree,Neither Agree nor Disagree,Neither Agree nor Disagree,Neither Agree nor Disagree,Neither Agree nor Disagree,Neither Agree nor Disagree,Neither Agree nor Disagree,Neither Agree nor Disagree,Neither Agree nor Disagree,Neither Agree nor Disagree,Slightly Agree,Neither Agree nor Disagree,Neither Agree nor Disagree,Neither Agree nor Disagree,Slightly Agree,Neither Agree nor Disagree,Neither Agree nor Disagree,Neither Agree nor Disagree,Neither Agree nor Disagree,Disagree,Disagree,Disagree,Agree,Neither Agree nor Disagree,Neither Agree nor Disagree,Neither Agree nor Disagree,Neither Agree nor Disagree,Neither Agree nor Disagree,Neither Agree nor Disagree,Neither Agree nor Disagree,Neither Agree nor Disagree,Neither Agree nor Disagree,Neither Agree nor Disagree,Neither Agree nor Disagree,Neither Agree nor Disagree,Neither Agree nor Disagree,Neither Agree nor Disagree,Neither Agree nor Disagree,Neither Agree nor Disagree,Neither Agree nor Disagree,Neither Agree nor Disagree,Neither Agree nor Disagree,Neither Agree nor Disagree,Neither Agree nor Disagree,Neither Agree nor Disagree,Neither Agree nor Disagree,Neither Agree nor Disagree,Neither Agree nor Disagree,Neither Agree nor Disagree,Neither Agree nor Disagree,Neither Agree nor Disagree,Neither Agree nor Disagree,Neither Agree nor Disagree,Disagree,Disagree,Agree,Strongly Disagree,Agree,Strongly Disagree,Not at all,Not at all,Not at all,Not really,Not really,Not really,Not at all,Neither Agree nor Disagree,Disagree,Disagree,Disagree,Disagree,Disagree,Disagree,Disagree,Neither Agree nor Disagree,Neither Agree nor Disagree,Disagree,Disagree,Disagree,Neither Agree nor Disagree,Neither Agree nor Disagree,Neither Agree nor Disagree,Neither Agree nor Disagree,Neither Agree nor Disagree,Neither Agree nor Disagree,Neither Agree nor Disagree,Neither Agree nor Disagree,Agree,
2022-08-02 12:32:23,2022-08-02 13:06:33,IP Address,216.106.151.65,100,2049,TRUE,2022-08-02 13:06:34,R_cvB3GmwxgDk7avL,,,,,44.0683,-123.0763,anonymous,EN,,F_3R3lw6uJkyf4EkU,signature.png,14256,image/png,d23_02,20,Female (cisgender or transgender),Female,White,"No, not of Hispanic, Latino/a/x, or Spanish origin",Slightly Agree,Strongly Agree,Strongly Disagree,Neither Agree or Disagree,Slightly Agree,Slightly Agree,Slightly Disagree,Slightly Disagree,Slightly Disagree,Slightly Disagree,Strongly Agree,Strongly Agree,Strongly Agree,Slightly Agree,Slightly Agree,Strongly Agree,Strongly Disagree,Strongly Agree,Slightly Agree,Neither Agree or Disagree,Slightly Disagree,Strongly Agree,Strongly Agree,Strongly Agree,Slightly Disagree,Slightly Disagree,Slightly Disagree,Strongly Disagree,Slightly Disagree,Slightly Disagree,Slightly Agree,Neither Agree or Disagree,Strongly Disagree,Strongly Disagree,Strongly Disagree,Slightly Agree,Slightly Disagree,Strongly Agree,Slightly Agree,Slightly Agree,Slightly Disagree,Slightly Agree,Strongly Agree,Strongly Agree,Strongly Agree,Slightly Agree,Strongly Disagree,Strongly Agree,Slightly Agree,Neither Agree or Disagree,Slightly Disagree,Slightly Disagree,Once in a great While,Sometimes,Once in a great While,Practically Never,Fairly Often,Fairly Confident,Practically Never,Slightly,Not Very Long,Not at All,Sometimes,Practically Never,Very Confident,Once in a great While,Once in a great While,Fairly Much,Sometimes,Sometimes,Practically Never,Sometimes,Sometimes,Once in a great While,Very Often,Not Very Much,Sometimes,Fairly Often,Sometimes,Practically Never,Sometimes,Practically Never,Fairly Confident,Not at All,Slightly,Once in a great While,Slightly,Not very Rattled,I am quite confident,I am very confident,I am somewhat confident,I am somewhat confident,I am very confident,I am quite confident,I am quite confident,I am somewhat confident,I am very confident,Never,Occasionally,Occasionally,Never,Never,Never,Never,Occasionally,Never,Never,Slightly Disagree,Slightly agree,Agree,Agree,Agree,Agree,Agree,Disagree,Agree,Agree,Rarely,Never,Never,Never,Rarely,Sometimes,Sometimes,Never,Never,Never,Never,Never,Never,Rarely,Never,Never,Never,Sometimes,Never,Never,Never,Never,Sometimes,Never,Never,Never,Never,Sometimes,5 years 11 months ,FRIEND: close friend (non-romantic),Very close,Very close,Strongly Disagree,Strongly Agree,Strongly Disagree,Neither Agree nor Disagree,Slightly Disagree,Strongly Agree,Neither Agree nor Disagree,Neither Agree nor Disagree,Slightly Disagree,Slightly Disagree,Strongly Agree,Strongly Agree,Strongly Agree,Slightly Agree,Slightly Agree,Strongly Agree,Neither Agree nor Disagree,Slightly Agree,Slightly Agree,Slightly Disagree,Slightly Disagree,Slightly Agree,Slightly Agree,Strongly Agree,Slightly Agree,Slightly Disagree,Slightly Agree,Slightly Disagree,Slightly Agree,Slightly Disagree,Strongly Agree,Strongly Agree,Strongly Agree,Strongly Agree,Agree,Disagree,Agree,Agree,Strongly Disagree,Strongly Agree,Strongly Agree,Strongly Agree,Strongly Agree,Agree,Strongly Disagree,Neither Agree nor Disagree,Disagree,Disagree,Agree,Agree,Agree,Disagree,Disagree,Agree,Agree,Disagree,Agree,Agree,Disagree,Agree,Disagree,Disagree,Agree,Agree,Agree,Agree,Agree,Disagree,Agree,Agree,Not at all,Not at all,Not at all,Not at all,Not at all,Not at all,Not at all,Agree,Agree,Disagree,Strongly Agree,Disagree,Agree,Agree,Disagree,Disagree,Neither Agree nor Disagree,Disagree,Neither Agree nor Disagree,Neither Agree nor Disagree,Agree,Neither Agree nor Disagree,Disagree,Agree,Agree,Agree,Agree,Strongly Agree,Disagree,
2022-08-02 19:26:46,2022-08-02 19:51:12,IP Address,63.155.10.231,100,1466,TRUE,2022-08-02 19:51:14,R_3ml2CsCLxFVmiUB,,,,,44.0645,-123.1461,anonymous,EN,,F_2VsC3r383ec3MqZ,signature.png,15005,image/png,d21_01,26,Male (cisgender or transgender),Male,White,"No, not of Hispanic, Latino/a/x, or Spanish origin",Strongly Disagree,Slightly Agree,Strongly Disagree,Slightly Disagree,Strongly Agree,Strongly Agree,Neither Agree or Disagree,Slightly Disagree,Slightly Disagree,Slightly Agree,Slightly Agree,Slightly Agree,Strongly Agree,Strongly Agree,Slightly Agree,Strongly Agree,Strongly Disagree,Strongly Agree,Strongly Agree,Strongly Disagree,Slightly Disagree,Strongly Agree,Strongly Agree,Strongly Agree,Strongly Agree,Slightly Disagree,Slightly Agree,Slightly Disagree,Slightly Disagree,Strongly Disagree,Strongly Agree,Slightly Agree,Strongly Agree,Strongly Disagree,Neither Agree or Disagree,Strongly Agree,Slightly Disagree,Strongly Agree,Strongly Agree,Strongly Agree,Slightly Disagree,Strongly Agree,Strongly Agree,Strongly Agree,Strongly Agree,Strongly Agree,Slightly Disagree,Strongly Agree,Strongly Agree,Slightly Agree,Strongly Agree,Neither Agree or Disagree,Once in a great While,Once in a great While,Practically Never,Sometimes,Fairly Often,Fairly Confident,Practically Never,Not Very Much,Not Very Long,Not at All,Sometimes,Practically Never,Fairly Confident,Once in a great While,Practically Never,Not Very Much,Once in a great While,Once in a great While,Practically Never,Practically Never,Once in a great While,Practically Never,Once in a great While,Not at All,Once in a great While,Once in a great While,Practically Never,Once in a great While,Sometimes,Practically Never,Fairly Confident,Not Very Much,Not Very Much,Once in a great While,Slightly,Not very Rattled,I am quite confident,I am quite confident,I am very confident,I am very confident,I am very confident,I am very confident,I am very confident,I am very confident,I am very confident,Never,Occasionally,Occasionally,Never,Occasionally,Never,Occasionally,Never,Never,Never,Neither agree or disagree,Neither agree or disagree,Agree,Strongly Agree,Agree,Agree,Agree,Disagree,Agree,Disagree,Rarely,Never,Rarely,Rarely,Never,Rarely,Sometimes,Never,Sometimes,Rarely,Sometimes,Rarely,Rarely,Sometimes,Rarely,Never,Rarely,Sometimes,Rarely,Never,Never,Sometimes,Sometimes,Never,Rarely,Never,Never,Sometimes,"0 years, 2 months",ACQUAINTANCE,Not close at all,Not close at all,Slightly Agree,Strongly Agree,Strongly Disagree,Neither Agree nor Disagree,Slightly Disagree,Slightly Disagree,Strongly Disagree,Slightly Disagree,Neither Agree nor Disagree,Slightly Disagree,Neither Agree nor Disagree,Slightly Agree,Strongly Agree,Strongly Agree,Neither Agree nor Disagree,Slightly Disagree,Slightly Disagree,Slightly Agree,Slightly Agree,Slightly Disagree,Slightly Agree,Slightly Agree,Strongly Agree,Slightly Agree,Slightly Agree,Neither Agree nor Disagree,Slightly Disagree,Slightly Disagree,Slightly Disagree,Slightly Disagree,Strongly Disagree,Strongly Disagree,Agree,Agree,Disagree,Disagree,Agree,Agree,Neither Agree nor Disagree,Strongly Disagree,Disagree,Disagree,Disagree,Disagree,Strongly Disagree,Strongly Disagree,Strongly Disagree,Strongly Disagree,Agree,Agree,Disagree,Agree,Disagree,Agree,Agree,Disagree,Agree,Agree,Disagree,Agree,Disagree,Agree,Neither Agree nor Disagree,Agree,Disagree,Disagree,Agree,Disagree,Agree,Disagree,Not really,Not at all,Not at all,Not at all,Not at all,Somewhat,Not really,Disagree,Disagree,Neither Agree nor Disagree,Strongly Disagree,Disagree,Neither Agree nor Disagree,Disagree,Disagree,Neither Agree nor Disagree,Disagree,Disagree,Neither Agree nor Disagree,Agree,Neither Agree nor Disagree,Neither Agree nor Disagree,Disagree,Disagree,Disagree,Agree,Disagree,Agree,Agree,
2022-08-03 17:53:46,2022-08-03 18:29:21,IP Address,73.96.128.164,100,2135,TRUE,2022-08-03 18:29:23,R_1dtpxmsRCiqbn6x,,,,,44.0683,-123.0763,anonymous,EN,,F_5tgAZGg3yUXYGVX,signature.png,7328,image/png,d24_02,20,Female (cisgender or transgender),Female,White,"No, not of Hispanic, Latino/a/x, or Spanish origin",Strongly Agree,Strongly Agree,Slightly Disagree,Strongly Agree,Strongly Agree,Slightly Disagree,Slightly Disagree,Slightly Agree,Slightly Agree,Strongly Disagree,Neither Agree or Disagree,Slightly Agree,Strongly Agree,Neither Agree or Disagree,Slightly Agree,Slightly Agree,Strongly Disagree,Slightly Agree,Slightly Disagree,Slightly Disagree,Neither Agree or Disagree,Strongly Agree,Slightly Agree,Slightly Disagree,Slightly Agree,Slightly Agree,Slightly Disagree,Strongly Disagree,Slightly Disagree,Slightly Disagree,Strongly Agree,Strongly Agree,Strongly Agree,Strongly Disagree,Slightly Disagree,Slightly Agree,Strongly Disagree,Strongly Agree,Slightly Agree,Strongly Agree,Strongly Disagree,Strongly Agree,Slightly Agree,Strongly Agree,Strongly Agree,Slightly Agree,Strongly Disagree,Slightly Agree,Slightly Agree,Slightly Agree,Slightly Agree,Strongly Agree,Fairly Often,Fairly Often,Very Often,Very Often,Sometimes,Not very Confident,Practically Never,Very Much,Very Long,Fairly Much,Fairly Often,Once in a great While,Slightly,Fairly Often,Very Often,Fairly Much,Sometimes,Fairly Often,Once in a great While,Very Often,Very Often,Fairly Often,Fairly Often,Slightly,Sometimes,Fairly Often,Very Often,Sometimes,Fairly Often,Sometimes,Not very Confident,Very Much,Very Much,Very Often,Slightly,Slightly Rattled,I am quite confident,I am somewhat confident,I am somewhat confident,I am somewhat confident,I am quite confident,I am quite confident,I am somewhat confident,I am quite confident,I am somewhat confident,Never,Half of the time,Occasionally,Never,Half of the time,Half of the time,Occasionally,Half of the time,Never,Occasionally,Slightly Disagree,Disagree,Slightly agree,Slightly agree,Neither agree or disagree,Agree,Neither agree nor disagree,Agree,Agree,Neither agree nor disagree,Never,Rarely,Never,Rarely,Never,Often,Rarely,Never,Never,Never,Sometimes,Never,Never,Rarely,Never,Rarely,Sometimes,Sometimes,Rarely,Never,Never,Never,Never,Never,Rarely,Never,Never,Rarely,0 years 10 months,WORK: co-worker,Not close at all,Not close at all,Strongly Disagree,Strongly Agree,Strongly Disagree,Slightly Disagree,Strongly Agree,Strongly Agree,Strongly Disagree,Strongly Disagree,Slightly Disagree,Strongly Disagree,Slightly Agree,Strongly Agree,Strongly Agree,Strongly Agree,Strongly Agree,Strongly Agree,Strongly Disagree,Strongly Agree,Strongly Agree,Strongly Disagree,Strongly Disagree,Strongly Agree,Strongly Agree,Strongly Agree,Strongly Agree,Slightly Disagree,Strongly Disagree,Strongly Disagree,Strongly Disagree,Strongly Disagree,Disagree,Disagree,Strongly Disagree,Strongly Agree,Neither Agree nor Disagree,Disagree,Agree,Strongly Disagree,Disagree,Strongly Disagree,Strongly Disagree,Agree,Neither Agree nor Disagree,Agree,Strongly Disagree,Neither Agree nor Disagree,Strongly Disagree,Strongly Disagree,Strongly Disagree,Strongly Disagree,Neither Agree nor Disagree,Neither Agree nor Disagree,Strongly Disagree,Agree,Strongly Agree,Strongly Disagree,Strongly Agree,Strongly Agree,Strongly Disagree,Strongly Agree,Neither Agree nor Disagree,Disagree,Neither Agree nor Disagree,Strongly Agree,Strongly Disagree,Strongly Disagree,Strongly Agree,Strongly Disagree,Strongly Agree,Neither Agree nor Disagree,Not at all,Not at all,Not at all,Not at all,Not at all,Not at all,Not at all,Agree,Neither Agree nor Disagree,Agree,Disagree,Strongly Disagree,Disagree,Strongly Disagree,Neither Agree nor Disagree,Disagree,Strongly Disagree,Strongly Disagree,Agree,Strongly Disagree,Neither Agree nor Disagree,Agree,Strongly Agree,Agree,Agree,Agree,Strongly Agree,Agree,Strongly Agree,
